{
    "id": "8dus70pu05tawcdi",
    "birthDate": "1992-11-16",
    "email": "Heloise_Beahan3@hotmail.com",
    "firstName": "Cielo",
    "lastName": "Leffler",
    "gender": "female",
    "status": false,
    "createdAt": "2014-10-30T22:13:58.210Z",
    "updatedAt": "2014-10-30T22:13:58.210Z",
    "idArray": [
        "rd9k0cgdi7ap2e29",
        "ziebfsxjmgf1or",
        "12shga4rysyvi",
        "f5ze1ips6hjpds4i",
        "dyp12nqs929vbo6r",
        "vf2of9g9ndnrvn29",
        "m9v800lg9r90ms4i",
        "nmtcrykjbz3q5mi",
        "ls01ijlwk8nwb3xr",
        "g1i5addg2jkvgqfr",
        "85qyp87ok7ggy14i",
        "aaevo44euxt4vx6r",
        "1lqqvjtang0hpvi",
        "trztaam7uar1kyb9",
        "u88pxpn17mhd7vi",
        "z00yjtqwszbvgqfr"
    ],
    "points": 3
}